{
  "schema_version": "openclaw.task-runner.handoff-manifest.v1alpha1",
  "manifest_id": "handoff:task-intake-host-affecting",
  "task_id": "task-intake-host-affecting",
  "run_id": "run-20260322-intake-host-affecting",
  "reviewed_task": {
    "kind": "operator_review_bundle",
    "bundle_id": "review:operator:intake:hcr-20260322-intake-host-affecting",
    "bundle_type": "OPERATOR_REVIEW_BUNDLE",
    "review_target": "operator",
    "review_status": "pending_operator_review",
    "dispatch_scope": "host_affecting",
    "dispatch_status": "operator_approval_required",
    "requires_operator_approval": true,
    "broker_request_count": 6,
    "source_path": "fixtures/control-plane-replay/valid-host-affecting/operator-review-bundle.json",
    "staged_relpath": "tasks/task-intake-host-affecting/inputs/control-plane/operator-review-bundle.json"
  },
  "source_summary": {
    "source_path": "fixtures/control-plane-replay/valid-host-affecting/summary.json",
    "staged_relpath": "tasks/task-intake-host-affecting/inputs/control-plane/task-runner-summary.json"
  },
  "task_dir": {
    "root_relpath": "tasks/task-intake-host-affecting",
    "repo_relpath": "tasks/task-intake-host-affecting/repo",
    "inputs_relpath": "tasks/task-intake-host-affecting/inputs",
    "outputs_relpath": "tasks/task-intake-host-affecting/outputs"
  },
  "repo_seed": {
    "strategy": "changed_files_subset",
    "changed_files": [
      "schemas/broker-ready-request.schema.json",
      "schemas/task-runner-intake-report.schema.json",
      "scripts/build-broker-ready-request.py",
      "scripts/check-task-runner-intake-flow.sh"
    ]
  },
  "staged_inputs": {
    "request_md": "tasks/task-intake-host-affecting/inputs/request.md",
    "context_json": "tasks/task-intake-host-affecting/inputs/context.json",
    "control_plane_dir": "tasks/task-intake-host-affecting/inputs/control-plane",
    "control_plane_artifacts": [
      {
        "name": "reviewed_task",
        "source_path": "fixtures/control-plane-replay/valid-host-affecting/operator-review-bundle.json",
        "staged_relpath": "tasks/task-intake-host-affecting/inputs/control-plane/operator-review-bundle.json"
      },
      {
        "name": "summary_json",
        "source_path": "fixtures/control-plane-replay/valid-host-affecting/summary.json",
        "staged_relpath": "tasks/task-intake-host-affecting/inputs/control-plane/task-runner-summary.json"
      },
      {
        "name": "normalized_request_path",
        "source_path": "fixtures/control-plane-replay/valid-host-affecting/request.normalized.json",
        "staged_relpath": "tasks/task-intake-host-affecting/inputs/control-plane/request.normalized.json"
      },
      {
        "name": "intake_report_path",
        "source_path": "fixtures/control-plane-replay/valid-host-affecting/intake-report.json",
        "staged_relpath": "tasks/task-intake-host-affecting/inputs/control-plane/intake-report.json"
      },
      {
        "name": "routing_decision_path",
        "source_path": "fixtures/control-plane-replay/valid-host-affecting/routing-decision.json",
        "staged_relpath": "tasks/task-intake-host-affecting/inputs/control-plane/routing-decision.json"
      },
      {
        "name": "submission_envelope_path",
        "source_path": "fixtures/control-plane-replay/valid-host-affecting/operator-approval-envelope.json",
        "staged_relpath": "tasks/task-intake-host-affecting/inputs/control-plane/operator-approval-envelope.json"
      }
    ]
  },
  "execution_contract": {
    "workspace_mode": "dev",
    "runner": "codex",
    "network_mode": "none",
    "workspace_layout_path": "tasks/task-intake-host-affecting/workspace-layout.json",
    "exec_plan_path": "tasks/task-intake-host-affecting/exec-plan.json"
  },
  "boundary_carry_forward": {
    "repo_side_only": true,
    "live_side_publish_performed": false,
    "broker_dispatch_performed": false,
    "real_docker_run_required": false,
    "openclaw_runtime_modified": false
  }
}
